Position,Company,Location,URL
2023년 KB국민카드 ICT부문의 전체 세부 정보,KB국민카드, 서울 종로구, https://kr.indeed.com/rc/clk?jk=e4ef666a8bb97bed&fccid=7d9fa3652fee48c0&vjs=3
2023 Software Engineering Intern  People with Disabilities (장애인 채용)의 전체 세부 정보,Google, 서울, https://kr.indeed.com/rc/clk?jk=ed7b7e6eb72ffab8&fccid=a5b4499d9e91a5c6&vjs=3
[양재역] 데이터분석(석박사급 R Python Matlab)의 전체 세부 정보,시니어앤파트너즈, 서울 서초구, https://kr.indeed.com/rc/clk?jk=a46105d1d0f9fa53&fccid=59060ddcdf96b101&vjs=3
각 부문별의 전체 세부 정보,두나무, 서울 강남구, https://kr.indeed.com/rc/clk?jk=cc26588019a45caa&fccid=6723a9d496e46445&vjs=3
디지털 자산 리서치 인턴의 전체 세부 정보,두나무, 서울 강남구, https://kr.indeed.com/rc/clk?jk=441c717c2b82b684&fccid=6723a9d496e46445&vjs=3
디지털 자산 리서치 인턴의 전체 세부 정보,Dunamu, 서울, https://kr.indeed.com/rc/clk?jk=a5b4dfb90415269e&fccid=54c9c086b03b7cdc&vjs=3
Python Backend Engineer의 전체 세부 정보,두나무, 서울 강남구, https://kr.indeed.com/rc/clk?jk=20d792ea3f7471fa&fccid=6723a9d496e46445&vjs=3
백엔드 개발자(인턴십)의 전체 세부 정보,액스, 서울 서초구, https://kr.indeed.com/rc/clk?jk=b7223c792bfcbcd4&fccid=5013eca338141e7d&vjs=3
전문연구요원 (병역특례) 수시 (AI / SW 분야)의 전체 세부 정보,딥엑스, 성남 분당구, https://kr.indeed.com/rc/clk?jk=d83fc0dd2641f483&fccid=e34932b8232a173b&vjs=3
인공지능(AI) 기술 개발(신입)의 전체 세부 정보,(주)RGA Inc., 서울 강남역, https://kr.indeed.com/company/(%EC%A3%BC)RGA-Inc./jobs/%EC%9D%B8%EA%B3%B5%EC%A7%80%EB%8A%A5-95a7a9b4c00f9ada?fccid=dd616958bd9ddc12&vjs=3
2023년 DIgital Lab 전문계약직 상시의 전체 세부 정보,GS칼텍스, 서울 강남구, https://kr.indeed.com/rc/clk?jk=2e45e43017a6ea1f&fccid=f152288f3dcf6e51&vjs=3
딥러닝 통한 인공지능 솔루션 개발자의 전체 세부 정보,엘세븐시큐리티, 서울 송파구, https://kr.indeed.com/rc/clk?jk=554e814302b8a380&fccid=72880ee98034ba13&vjs=3
기술 인턴 인공지능 응용 연구/개발 인턴의 전체 세부 정보,써로마인드로보틱스, 서울 관악구, https://kr.indeed.com/rc/clk?jk=71c47ac87bb4087e&fccid=230e414668234579&vjs=3
상시지원 (AI & ML Engineer)의 전체 세부 정보,Riiid Labs, 서울, https://kr.indeed.com/rc/clk?jk=14a95a5daad2295e&fccid=933989f3b0ffe928&vjs=3
서버 엔지니어 (Python)의 전체 세부 정보,페이히어, 서울 강남구, https://kr.indeed.com/rc/clk?jk=5ccb95e3fe5f6994&fccid=254f50a1adb01cad&vjs=3
[메이저 금융그룹 연구소] Data Scientist 경력직 연구원 포지션의 전체 세부 정보,메이저 금융그룹 연구소, 서울, https://kr.indeed.com/company/%EB%8D%94-%ED%9C%B4%EB%A8%BC/jobs/Data-Scientist-%EA%B2%BD%EB%A0%A5%EC%A7%81-%EC%97%B0%EA%B5%AC%EC%9B%90-%ED%8F%AC%EC%A7%80%EC%85%98-f8a5bc05f47465f8?fccid=3cfe13845f73c09f&vjs=3
[선릉역] 서버개발 백엔드(앱 웹 AWS Python)의 전체 세부 정보,시니어앤파트너즈, 서울 강남구, https://kr.indeed.com/rc/clk?jk=6347d79975d98fa3&fccid=59060ddcdf96b101&vjs=3
[삼성중공업 취업률 60] 23년 DT 제조혁신 양성과정의 전체 세부 정보,삼성중공업 거제조선소, 경상남도, https://kr.indeed.com/rc/clk?jk=e14395aeaef03617&fccid=26e0feb8bfeca210&vjs=3
2023 Student Training in Engineering Program (STEP)  People with Disabilities (장애인 채용)의 전체 세부 정보,Google, 서울, https://kr.indeed.com/rc/clk?jk=5d24a062cabc9f0d&fccid=a5b4499d9e91a5c6&vjs=3
데이터분석 신입/경력 정규직의 전체 세부 정보,블록스퀘어서울, 서울 서초구, https://kr.indeed.com/rc/clk?jk=88960e11c2cdd682&fccid=72348558bd9456ba&vjs=3
Machine Learning Engineer Intern - Korea의 전체 세부 정보,MOLOCO, 서울, https://kr.indeed.com/rc/clk?jk=69d3cc2cca262747&fccid=6588d205440cdcb9&vjs=3
[병역 특례 가능] 백엔드 엔지니어(Python)의 전체 세부 정보,피플펀드컴퍼니, 서울 서초구, https://kr.indeed.com/rc/clk?jk=3cbd2f42de625fab&fccid=10d9fdf90a5a21a4&vjs=3
Operations Manager의 전체 세부 정보,Uber, 서울, https://kr.indeed.com/rc/clk?jk=f915c9a9f8f8a554&fccid=f766f8bfbc3effb7&vjs=3
Quantitative Researcher의 전체 세부 정보,WorldQuant, 서울, https://kr.indeed.com/rc/clk?jk=e7e8586d716fcf24&fccid=08487f979320ebae&vjs=3
Machine Learning Researcher (Computer Vision)의 전체 세부 정보,BOEING, 서울, https://kr.indeed.com/rc/clk?jk=01f44c38aeb64f17&fccid=edae4285faf6c2f0&vjs=3
JR0192526 SW engineer intern의 전체 세부 정보,인텔코리아, 서울, https://kr.indeed.com/rc/clk?jk=83f4939522ffaa68&fccid=ded06d6a6799d929&vjs=3
[SAPEON Korea] Frontend Compiler Engineer의 전체 세부 정보,사피온코리아, 성남 분당구, https://kr.indeed.com/rc/clk?jk=25efb0f8ef36cbda&fccid=3e45ffdcf8435b2d&vjs=3
Data/Machine Learning Engineer (신입)의 전체 세부 정보,플리토, 서울 강남구, https://kr.indeed.com/rc/clk?jk=5ab0b45dfa93411b&fccid=01aed038bcce2a5f&vjs=3
Data Scientist의 전체 세부 정보,Toss, 서울, https://kr.indeed.com/rc/clk?jk=9cb8324539546a71&fccid=18c4935c8ec646d5&vjs=3
Data Engineering[책임매니저(G3)]의 전체 세부 정보,현대자동차그룹, 서울 양재역, https://kr.indeed.com/rc/clk?jk=2227849edfa12196&fccid=980d6ecc399a3373&vjs=3
[KREAM] Strategy DA 체험형 인턴의 전체 세부 정보,크림, 성남 분당구, https://kr.indeed.com/rc/clk?jk=17a487fd0a2bd71e&fccid=146c028635667214&vjs=3
웹개발  백엔드 외 신입/경력 정규직의 전체 세부 정보,코인챗, 서울 강남구, https://kr.indeed.com/rc/clk?jk=e3f3b7e2103d9bc7&fccid=e60f835b4d91f8e6&vjs=3
Robotics Engineer [Computer Vision][연구원  책임연구원]의 전체 세부 정보,현대자동차그룹, 대한민국, https://kr.indeed.com/rc/clk?jk=d18652df74e7a983&fccid=980d6ecc399a3373&vjs=3
AI 연구 MLOps의 전체 세부 정보,코그넷나인, 서울 서초구, https://kr.indeed.com/rc/clk?jk=36ae5f764253d121&fccid=015d2bad6d9df969&vjs=3
[TaaS] Data Scientist[연구원  책임연구원]의 전체 세부 정보,현대자동차그룹, 서울 강남구, https://kr.indeed.com/rc/clk?jk=67b03ffab1c536ba&fccid=980d6ecc399a3373&vjs=3
파이썬 개발자 초중급 이상의 전체 세부 정보,데이터앤솔루션, 서울 서초구, https://kr.indeed.com/rc/clk?jk=d158e683dc0b7500&fccid=02f32b94107c54e3&vjs=3
[NH선물] 2023년 직원 -IT  서비스 기획의 전체 세부 정보,엔에이치선물, 서울 영등포구, https://kr.indeed.com/rc/clk?jk=4e7a12fda7c2737d&fccid=8c476b3f192227fd&vjs=3
2023년 메타버스 아카데미 2기 교육생의 전체 세부 정보,한국전파진흥협회, 성남 분당구, https://kr.indeed.com/rc/clk?jk=39d19b49e76b203d&fccid=4f2ea8d6d8ab34ba&vjs=3
엔셀주식회사 SW개발자(솔루션/Web/풀스택)의 전체 세부 정보,엔셀, 성남 분당구, https://kr.indeed.com/rc/clk?jk=f15a77a5cf5ec7c4&fccid=c59ef9b756f9ad5c&vjs=3
Data Scientist  Growth Analytics Intern - Korea의 전체 세부 정보,MOLOCO, 서울, https://kr.indeed.com/rc/clk?jk=3d0e22b9756facb8&fccid=6588d205440cdcb9&vjs=3
[글로벌 대형 디지털마케팅 기업] CRM 데이터 분의 전체 세부 정보,국내 대기업 그룹 유통 계열사, 서울 용산구, https://kr.indeed.com/company/%EC%99%B8%EA%B5%AD%EA%B3%84-%EB%8C%80%ED%98%95-%EB%94%94%EC%A7%80%ED%84%B8%EB%A7%88%EC%BC%80%ED%8C%85-%ED%9A%8C%EC%82%AC/jobs/Cr-bfa6b6e58b76b00b?fccid=1e02e235dd9382a8&vjs=3
Machine Learning R&D 연구원의 전체 세부 정보,카이어, 서울 서초구, https://kr.indeed.com/rc/clk?jk=19da3484bd7a72f1&fccid=908ef26c4dd7595f&vjs=3
2023년 상반기 백엔드 개발자의 전체 세부 정보,반달소프트, 성남 분당구, https://kr.indeed.com/rc/clk?jk=1601f1bfe3302af5&fccid=f35f7fc5e918087a&vjs=3
Battery DT혁신 경력의 전체 세부 정보,에스케이온, 서울 종로구, https://kr.indeed.com/rc/clk?jk=3be7ae7d903b8f1e&fccid=5abd05357e37be67&vjs=3
AI-DX 3월의 전체 세부 정보,교원그룹, 서울특별시, https://kr.indeed.com/rc/clk?jk=202f821c39396450&fccid=dd616958bd9ddc12&vjs=3
백엔드 엔지니어 (Python/Javascript)의 전체 세부 정보,시스메틱, 서울 영등포구, https://kr.indeed.com/rc/clk?jk=dc4b5e342e7ae6a0&fccid=6cc748c560420a2e&vjs=3
[국비무료] AI [인공지능] 교육생의 전체 세부 정보,청주대학교산학협력단, 청주 청원구, https://kr.indeed.com/rc/clk?jk=26859414610952fb&fccid=58723b6657c785ce&vjs=3
Infra Engineering[책임매니저(G4)]의 전체 세부 정보,현대자동차그룹, 서울 양재역, https://kr.indeed.com/rc/clk?jk=4fbc9e8cee784eb8&fccid=980d6ecc399a3373&vjs=3
[위메프서비스] 서비스 백엔드 주니어 개발자의 전체 세부 정보,위메프, 대한민국, https://kr.indeed.com/rc/clk?jk=4bbe98923e49db2e&fccid=2f8799a5ef214646&vjs=3
Data & Reporting Analyst의 전체 세부 정보,AIA, 서울, https://kr.indeed.com/rc/clk?jk=f15d2672714490bf&fccid=004041685e219574&vjs=3
2023년 한화시스템 석/박사 신입 및 경력 채용 (SW분야)의 전체 세부 정보,한화그룹, 서울, https://kr.indeed.com/rc/clk?jk=540ce8adcf30a84b&fccid=bd0dc1817223394f&vjs=3
Deep Learning Engineer의 전체 세부 정보,뷰런테크놀로지, 서울 서초구, https://kr.indeed.com/rc/clk?jk=a29c229f6b2fc651&fccid=98608656606c0861&vjs=3
2023년 3월 롯데정보통신 경력사원의 전체 세부 정보,롯데정보통신, 서울 금천구, https://kr.indeed.com/rc/clk?jk=7308ce00c93807e4&fccid=ae6a0ecfe23adfb7&vjs=3
AI 백엔드 개발부문 인재의 전체 세부 정보,신세계아이앤씨, 서울 중구, https://kr.indeed.com/rc/clk?jk=b047d88258576e1c&fccid=7009e9adee12ff99&vjs=3
Perception Engineer의 전체 세부 정보,뷰런테크놀로지, 서울 서초구, https://kr.indeed.com/rc/clk?jk=2a19716df6d54971&fccid=98608656606c0861&vjs=3
이공지능(AI) / 딥러닝 / Computer Vision 경력자 정규직의 전체 세부 정보,더블미, 서울 서초구, https://kr.indeed.com/rc/clk?jk=bc5131eb1f2981cb&fccid=d7e01b6267e5ba2d&vjs=3
위시켓과 함께할 서버개발자님의 전체 세부 정보,위시켓, 서울 강남구, https://kr.indeed.com/rc/clk?jk=a3a65a4d59061430&fccid=533c91503ff32d48&vjs=3
SSG랜더스 2023년 마케팅팀 신규의 전체 세부 정보,신세계야구단, 인천, https://kr.indeed.com/rc/clk?jk=a31927b61381ec99&fccid=6d6b9bb9c03080ed&vjs=3
2023년도 ICT확산사업(충청권) 충남대학교 AI복합교육과정 데이터사이언티스트(DSAC) 자격취득과정 교육의 전체 세부 정보,충남대학교산학협력단, 대전 유성구, https://kr.indeed.com/rc/clk?jk=9606ffa6461d13a7&fccid=fa0cc617f724d592&vjs=3
데이터마이닝  인공지능(AI) 외 경력의 전체 세부 정보,루벤티스, 서울 강남구, https://kr.indeed.com/rc/clk?jk=da437cb9cae31254&fccid=0513ee429c38f237&vjs=3
[Secta9ine] WEB 리포트 개발/운영 담당자 수시의 전체 세부 정보,섹타나인, 서울 서초구, https://kr.indeed.com/rc/clk?jk=521e2b8ce36fd34f&fccid=68e05d2f056f462c&vjs=3
[무료교육] 23년 방위산업 전문인력 양성사업 교육생의 전체 세부 정보,금오공과대학교산학협력단, 경상북도, https://kr.indeed.com/rc/clk?jk=41e67870d83c25c0&fccid=1834b826401e8f0c&vjs=3
[AI Lab] AI Assistant 자연어이해 모델 연구/개발자 영입의 전체 세부 정보,카카오엔터프라이즈, 성남 분당구, https://kr.indeed.com/rc/clk?jk=ac3bc0465977b363&fccid=e19aa33fc391b310&vjs=3
[램플코딩학원] 온오프라인 코딩 강사의 전체 세부 정보,밸류에잇 벤처스, 대전 서구, https://kr.indeed.com/rc/clk?jk=3415a2ec10f41d98&fccid=11d8b37b858f8313&vjs=3
데이터 엔지니어(Data Engineer) 인턴의 전체 세부 정보,와이즐리, 서울 강남구, https://kr.indeed.com/rc/clk?jk=9a3b257f905ec215&fccid=38e705c4dc4de31c&vjs=3
C++/Python 개발자 (병역특례 가능)의 전체 세부 정보,아우토크립트, 서울 영등포구, https://kr.indeed.com/rc/clk?jk=d2e4b66aaa70d0aa&fccid=70a92c8954e2b950&vjs=3
그룹공동 마이데이터 분석 플랫폼(데이터분석가)의 전체 세부 정보,KB데이타시스템, 서울 마포구, https://kr.indeed.com/rc/clk?jk=25b3c3e6a66bd77c&fccid=fe227fbd2afb9580&vjs=3
딥러닝 AI 개발 연구원의 전체 세부 정보,베이리스, 성남 수정구, https://kr.indeed.com/rc/clk?jk=87309d3ff40ead61&fccid=ce871e9e4a9f430a&vjs=3
[Engineering Div.] Data Analyst (경력 무관)의 전체 세부 정보,크래프톤, 서울 강남구, https://kr.indeed.com/rc/clk?jk=3ccbc30d82ce5848&fccid=0aeb279b74dee723&vjs=3
자율 주행  로봇 SW 개발자의 전체 세부 정보,에바, 성남 수정구, https://kr.indeed.com/rc/clk?jk=e30fe92d72ceb17c&fccid=5cc87f5890bd7170&vjs=3
Web Front-end 개발자의 전체 세부 정보,코그넷나인, 서울 서초구, https://kr.indeed.com/rc/clk?jk=6141229c69b83068&fccid=015d2bad6d9df969&vjs=3
Python 분석 인원 정규직 채용의 전체 세부 정보,(주)스마트모빌러티 관심기업, 서울 휘경동, https://kr.indeed.com/rc/clk?jk=5e761f105a377ae8&fccid=307824036b9dcb17&vjs=3
개발자 - Python 서버 프로그램 개발의 전체 세부 정보,바인테크, 서울 송파구, https://kr.indeed.com/rc/clk?jk=4cc15c26097421c5&fccid=aef44811e748bebe&vjs=3
[취업축하금300] 미스고 웹 크롤러 - 주거안정비 지원의 전체 세부 정보,미스고, 서울 강남구, https://kr.indeed.com/rc/clk?jk=dcea8f10155e3061&fccid=28ad02baea3e6b67&vjs=3
MLOps Engineer의 전체 세부 정보,비바리퍼블리카, 서울 강남구, https://kr.indeed.com/rc/clk?jk=24acbad36d821c25&fccid=17dc934b27d58446&vjs=3
Full-Time,Trustworthy, Anywhere in the World, https://weworkremotely.com/remote-jobs/trustworthy-full-stack-software-engineer-react-python
Full-Time,OpenCraft, Anywhere in the World, https://weworkremotely.com/remote-jobs/opencraft-senior-open-source-developer-devops-python-django-react-aws-openstack
Full-Time,Proxify AB, Anywhere in the World, https://weworkremotely.com/remote-jobs/proxify-ab-senior-python-engineer-long-term-job-100-remote
Full-Time,Parallel, USA Only, https://weworkremotely.com/remote-jobs/parallel-senior-python-engineer-django
Full-Time,TestGorilla, Anywhere in the World, https://weworkremotely.com/remote-jobs/testgorilla-senior-backend-engineer-python-10
Full-Time,Doximity, Americas Only, https://weworkremotely.com/remote-jobs/doximity-python-platform-engineer
Full-Time,XM, Anywhere in the World, https://weworkremotely.com/remote-jobs/xm-software-engineer-in-test-python-cyprus-greece-or-remote-2
